{
  "run_id": "2026-08-01T073018Z_ebbcb655",
  "timestamp": "2026-08-01T073018Z",
  "input_hash": "sha256:ebbcb6552880fc91f5434f60bd946230e2a4d8d8b37f2100deceec595f611a99",
  "schema_version": "judgment@1.0.0",
  "outputs": {
    "analyst": {
      "verdict": "approve",
      "confidence": "high",
      "escalate": false,
      "evidence_count": 9
    },
    "critic": {
      "verdict": "objection_raised",
      "confidence": "medium",
      "escalate": false,
      "evidence_count": 20
    },
    "independent": {
      "verdict": "approve",
      "confidence": "high",
      "escalate": false,
      "evidence_count": 10
    },
    "synthesizer": {
      "verdict": "needs_review",
      "confidence": "high",
      "escalate": true,
      "evidence_count": 27
    },
    "verifier": {
      "verdict": "verification_complete",
      "confidence": "high",
      "escalate": false,
      "evidence_count": 24
    }
  },
  "verification": {
    "schema_pass": true,
    "citations_pass": true
  },
  "routing": "escalated",
  "escalation_reason": "needs_review"
}